{"root":"<root>","framework":{"package":"@modelcontextprotocol/server","version":"2.3.1","style":"v2"},"entry":"src/index.ts","transport":{"kind":"http","evidence":"src/index.ts:85"},"tools":[{"name":"lookup-sku","schema_source":"zod-object","output_schema":true,"annotations":["readOnlyHint"],"side_effects":"none","read_only_call":true,"file":"src/index.ts","line":15},{"name":"adjust-stock","schema_source":"zod-object","output_schema":false,"annotations":[],"side_effects":"writes","read_only_call":false,"file":"src/index.ts","line":32},{"name":"list-low-stock","schema_source":"zod-object","output_schema":true,"annotations":["readOnlyHint","openWorldHint"],"side_effects":"none","read_only_call":true,"file":"src/index.ts","line":46}],"resources":[{"name":"inventory-summary","uri":"inventory://summary","dynamic":false}],"prompts":[{"name":"restock-report","args":1}],"auth":{"kind":"none","evidence":"no auth code found"},"state":{"kind":"module-global","evidence":"src/index.ts:6"},"ui":{"kind":"none","files":[]},"zod":{"version":"^4.4.3","needs_upgrade":false},"tests":{"present":false,"command":null},"deps_to_remove":["@modelcontextprotocol/server","@modelcontextprotocol/node"],"risks":["Node http server hand-routes /mcp via toNodeHandler(createMcpHandler); mcp-use owns the HTTP server","Module-global Map state is mutated by adjust-stock and is lost on restart","adjust-stock has no annotations (destructive/idempotent hints missing)","No lockfile and node_modules not installed","start script runs .ts directly with node","migration-calls.json lists sample calls (lookup-sku, list-low-stock) to replay after migration"]}
