{"root":"<root>","framework":{"package":"@modelcontextprotocol/sdk","version":"1.32.1","style":"McpServer"},"entry":"src/index.ts","transport":{"kind":"stdio","evidence":"src/index.ts:80"},"tools":[{"name":"lookup-sku","schema_source":"zod-shape","output_schema":true,"annotations":["readOnlyHint"],"side_effects":"none","read_only_call":true,"file":"src/index.ts","line":14},{"name":"adjust-stock","schema_source":"zod-shape","output_schema":false,"annotations":[],"side_effects":"writes","read_only_call":false,"file":"src/index.ts","line":32},{"name":"list-low-stock","schema_source":"zod-shape","output_schema":true,"annotations":["readOnlyHint","openWorldHint"],"side_effects":"none","read_only_call":true,"file":"src/index.ts","line":44}],"resources":[{"name":"inventory-summary","uri":"inventory://summary","dynamic":false}],"prompts":[{"name":"restock-report","args":1}],"auth":{"kind":"none","evidence":"no auth code found in src/index.ts"},"state":{"kind":"module-global","evidence":"src/index.ts:5"},"ui":{"kind":"none","files":[]},"zod":{"version":"^3.25.76","needs_upgrade":true},"tests":{"present":false,"command":null},"deps_to_remove":["@modelcontextprotocol/sdk"],"risks":["stdio clients must switch to a URL","adjust-stock mutates in-memory Map; state is lost on restart","mixed registerTool and legacy server.tool styles","package.json start runs node src/index.ts directly (type stripping); no lockfile present","@modelcontextprotocol/sdk not installed (node_modules absent)"]}
